{
  "$schema": "http://json-schema.org/draft-07/schema#",
  "$id": "https://lancer-job-board.local/schemas/reserve.schema.json",
  "title": "Reserve",
  "description": "A reserve item available for purchase in the store",
  "type": "object",
  "required": ["id", "rank", "name", "price", "description", "isCustom"],
  "properties": {
    "id": {
      "type": "string",
      "description": "Unique identifier (UUID)",
      "format": "uuid"
    },
    "rank": {
      "type": "number",
      "description": "Reserve rank/tier (1-3)",
      "minimum": 1,
      "maximum": 3,
      "multipleOf": 1
    },
    "name": {
      "type": "string",
      "description": "Reserve item name",
      "minLength": 1
    },
    "price": {
      "type": "number",
      "description": "Price in Manna currency",
      "minimum": 0,
      "multipleOf": 1
    },
    "description": {
      "type": "string",
      "description": "Reserve item description (multiline text, can be empty)"
    },
    "isCustom": {
      "type": "boolean",
      "description": "Whether this is a custom item (true) or default/legacy item (false)"
    },
    "adminLog": {
      "type": "string",
      "description": "GM-only notes (optional)"
    }
  },
  "additionalProperties": false,
  "notes": [
    "Legacy reserves from reserves.json should have isCustom: false",
    "Custom items added by admins should have isCustom: true",
    "Rank 1 = basic/common, Rank 2 = advanced/uncommon, Rank 3 = elite/rare"
  ]
}
