[
  {
    "id": "24d0834e-82cc-4236-a70c-868e1bd8c714",
    "rank": 1,
    "name": "SNAP HOOKS",
    "price": 2000,
    "description": "Quick Action, Limited 1.\nAutomatically grapple an adjacent target.\nCabled hooks launched from exterior-mounted ejection points for rapid, intimate engagement.",
    "isCustom": false
  },
  {
    "id": "f3ec4d0c-1004-4866-856b-7be954f01162",
    "rank": 1,
    "name": "MOLECULAR WHETSTONE",
    "price": 1500,
    "description": "Free Action, 1/round, Limited 1.\nAfter you successfully hit with a melee attack, but before damage is rolled, spend this reserve as a free action to cause the target to become Shredded until the end of the current turn.\nA device installed in a weapon's grip that sends an autophagic pulse up the blade, sharpening it before impact.",
    "isCustom": false
  },
  {
    "id": "af2fe676-7485-42c2-9dbf-9e6241efa35e",
    "rank": 1,
    "name": "KINETIC PULSE COIL",
    "price": 2500,
    "description": "Quick Action, Limited 1.\nRam every character in Burst 1.\nChassis-mounted woofers. Kinetic-absorbant coils gather latent energy from normal actions, such as walking, running, or fighting, until released with explosive force.",
    "isCustom": false
  },
  {
    "id": "4c0e4340-b55e-49f3-b4ff-c6232072b391",
    "rank": 1,
    "name": "ICARUS MULTISTAGE BOOSTER",
    "price": 2500,
    "description": "Free Action, Limited 1.\nWhen you make a standard move, spend this reserve as a free action to move your speed in a straight line.\nDual break-away boosters that help close the distance; or increase it, as needed.",
    "isCustom": false
  },
  {
    "id": "577cacbe-fc7f-4dd4-80e4-8fe8c1f0bf45",
    "rank": 1,
    "name": "REDUNDANT CLADDING",
    "price": 2000,
    "description": "Reaction, Limited 1.\nTrigger: You're successfully hit by an attack.\nEffect: You gain resistance to that attack, but are impaired until the end of your next turn.\nRough, but effective, armor plating that can take hits your normal armor might find disagreeable. Won't protect you from cockpit whiplash as a result of said impacts.",
    "isCustom": false
  },
  {
    "id": "d38e97ff-93ac-4ab9-9e5b-c09dc367e7f7",
    "rank": 1,
    "name": "CONCUSSIVE BRACER",
    "price": 2000,
    "description": "Free Action, Limited 2.\nWhen you successfully hit with a Ram, spend this reserve as a free action to give the target Impaired until the end of their next turn.\nAn external-fit gauntlet of extraordinary weight. The stored concussive energy is expended almost as quickly as its victims fall to the ground.",
    "isCustom": false
  },
  {
    "id": "c02c8c7e-911a-4a93-92aa-77e4957e47aa",
    "rank": 1,
    "name": "CUIRASS SHIELD GENERATOR",
    "price": 2000,
    "description": "Quick Action, 1/round, Deployable, Shield, Limited 2.\n1/round, Deploy a Cuirass Shield Generator in a free adjacent space.\nCuirass Shield Generator\nSize: 1, HP: 10, Evasion: 5\nCreates a Burst 1 energy field upon deployment. The next 3 attacks that target any character or object within this shield treat each target as having hard cover.\nAn emitter dish mounted on a rudimentary tripod. Its power supply is limited, but consistent enough to see frequent use in the field as a quick means of fortifying positions.",
    "isCustom": false
  },
  {
    "id": "45aa66a4-6851-442d-bf8b-3f18f44a172e",
    "rank": 1,
    "name": "SPARE AMMO",
    "price": 2500,
    "description": "Quick Action, Limited 1.\nReload any Loading weapon.\nBullet go in, bullet go out.",
    "isCustom": false
  },
  {
    "id": "e07cfe77-20f4-47d5-a31e-4278afbaa0f2",
    "rank": 1,
    "name": "SAND DISPENSER",
    "price": 2000,
    "description": "Quick Action, Limited 1.\nYou or an allied character within Range 3 immediately clears all Burn.\nSometimes a high tech problem needs a low tech solution.",
    "isCustom": false
  },
  {
    "id": "09d52f79-a881-4296-9792-4ced3f0cd2cc",
    "rank": 1,
    "name": "ADAPTIVE ROUNDS",
    "price": 1000,
    "description": "Protocol, Limited 5.\nChange the damage type of your next ranged attack to either Kinetic, Energy, or Explosive.\nEach shell casing is helpfully color coded to prevent accidental incineration in volatile environments.",
    "isCustom": false
  },
  {
    "id": "c56a0d97-1527-49e8-a7d5-9115df3d5706",
    "rank": 1,
    "name": "OVERPOWERED COILS",
    "price": 2000,
    "description": "Reaction, Limited 1.\nTrigger: Your attack deals bonus damage of any kind.\nEffect: The target is knocked back spaces equal to the bonus damage dealt.\nA cartridge mounted in convenient thumb reach for quick activation, bolstering the efficacy of existing weapon modifications. Burns out quick, so pick your moment.",
    "isCustom": false
  },
  {
    "id": "6ec6dd1b-91b2-41ce-9144-7cab48708caa",
    "rank": 1,
    "name": "REACTIVE SHUNT",
    "price": 1000,
    "description": "Free Action, Limited 1.\nWhen you brace, automatically clear all heat as a free action. All characters adjacent to you take heat equal to half of what you cleared.\nAn emergency vent built to disseminate excess reactor waste as quickly as possible. Make your choices everyone else's problem.",
    "isCustom": false
  },
  {
    "id": "e1b1b248-11ca-487a-94fc-993a02ef3a26",
    "rank": 1,
    "name": "THUMB CANNON",
    "price": 1500,
    "description": "Protocol, Limited 2.\nYou may Ram from up to range 5 until the end of this turn.\nArm-mounted, bulky, and thunderous, pilots are recommended to wear ear plugs before they charge it up.",
    "isCustom": false
  },
  {
    "id": "b2046bf1-a3b2-406b-8a01-ce7c6fd6e9a9",
    "rank": 1,
    "name": "FUEL RESERVES",
    "price": 1500,
    "description": "Protocol, Limited 2.\nAll movement actions (standard move, Boost, etc.) you take this round may move 1 additional space.\nKeep a little extra in the tank.",
    "isCustom": false
  },
  {
    "id": "af6d95aa-f125-4014-a6fd-74fcf9771c7b",
    "rank": 1,
    "name": "ACHILLES ROUND",
    "price": 2000,
    "description": "Limited 3.\nWhen you reload any weapon, that weapon's next attack gains the Overkill tag.\nSomeone carved a skull and crossbones into the shell casing.",
    "isCustom": false
  },
  {
    "id": "dd2eb7b9-aa46-402e-bbaf-5c0c3bdf27fb",
    "rank": 1,
    "name": "DEMO CHARGE",
    "price": 1000,
    "description": "Quick Action, Limited 1.\nImmediately deal 40 Kinetic damage to an adjacent object or piece of terrain.\nClear the view.",
    "isCustom": false
  },
  {
    "id": "6260fe4a-6d41-49c8-981a-3c3fdb2c5ef2",
    "rank": 1,
    "name": "EXPENDABLE RIFLING",
    "price": 1000,
    "description": "Protocol, Limited 3.\nYour next ranged attack has its Range extended by 5.\nA long barrel that screws to the end of your gun. Designed to fit all standard GMS munitions.",
    "isCustom": false
  },
  {
    "id": "4b8dd67e-9084-428a-9b65-1a078e00775a",
    "rank": 1,
    "name": "MASS-ECHO CHARGE",
    "price": 1500,
    "description": "Limited 1.\nWhenever you successfully hit with a tech attack, roll 1D20. On a natural 20, the target is stunned after the attack resolves. This reserve persists until triggered.\nA small, silvery chip installed in your mech's computer core. Contains enough malicious paracode to shut down a city block, so it can only be used in short bursts.",
    "isCustom": false
  },
  {
    "id": "21f8cc85-bc8c-44b0-9363-1626003c39b3",
    "rank": 1,
    "name": "SUPERMUNITIONS",
    "price": 2500,
    "description": "Protocol, Limited 1.\nYour next ranged attack that isn't a Cone, Line, or Burst gains Blast 1, in addition to its normal profile. If it's already Blast 1, it becomes Blast 2, and so on.\nVolatile, modular charges that multiply the tactical and geographic scope of all standard munitions.",
    "isCustom": false
  },
  {
    "id": "e7557250-d53e-4dd2-990b-bf27ca294d2c",
    "rank": 1,
    "name": "SILHOUETTE SCRAMBLERS",
    "price": 1500,
    "description": "Protocol, Limited 3.\nAttacks originating from further than Range 3 treat you as having hard cover until the end of your next turn.\nA cyber warfare suite that scatters and distorts your image on all visual wavelengths. You'll be less of a target and more of a cubist suggestion.",
    "isCustom": false
  },
  {
    "id": "8696e4dd-b079-4b61-8f2f-6afd62da1c19",
    "rank": 1,
    "name": "AUTO-FLECHETTES",
    "price": 2500,
    "description": "Reaction, Limited 1.\nTrigger: You successfully hit an Immobilized character with an attack.\nEffect: Deal 1D6 bonus damage.\nShoulder-mounted launchers that fire screaming bands of iron at speeds too slow to rely on in the heat of combat, but the trapped prey can do nothing but watch.",
    "isCustom": false
  },
  {
    "id": "57d1d1af-0f23-4e6d-9f2d-ecd262cf66be",
    "rank": 1,
    "name": "ICE OUT DEMO DISC",
    "price": 2000,
    "description": "Quick Action, Limited 2.\nSpend this reserve to gain Immunity to all tech actions until the start of your next turn.\nComes free in the mail with a subscription to any one of a number of exciting Smith Shimano services.",
    "isCustom": false
  },
  {
    "id": "91e054a3-1ea2-47fe-b0e1-edd4aff1b79c",
    "rank": 1,
    "name": "SPIDER TRAP",
    "price": 1500,
    "description": "Quick Action, Deployable, Limited 3.\nDeploy an electrified mesh that encompasses a free Blast 1 area within Range 5. Characters who start their turn in the Spider Trap or who enter it for the first time in a round must make an Engineering save or become Immobilized.\nYour parlor is the effective combat theater of the current engagement and the fly is a six ton somersaulting war robot with a nuclear reactor, but the principle isn't too far off.",
    "isCustom": false
  },
  {
    "id": "27a79d89-a748-4f57-aaaf-d41b2a4043ac",
    "rank": 1,
    "name": "SERVO LIMITER BYPASS",
    "price": 1500,